詞目id,義項id,詞性,解說
10711,14686,名詞,豆類。葉子呈卵狀菱形，開黃色蝶形花，花謝後結線形莢果。莢果內含綠色種子，種子可供煮湯或磨粉製成食品。
10712,14687,名詞,外型小、質地過硬的綠豆，浸泡在水中無法泡開且久煮仍不爛，常被棄食。
10713,14688,名詞,對人口頭上的稱謂。
10715,14690,名詞,計算的方法。
10718,14693,名詞,畜生。家中豢養的家禽或家畜。有時也用來罵人。
10719,14694,名詞,被聘請幫忙處理家務的人。
10720,14696,名詞,差別。
10721,14697,名詞,管理家務的女管家。
10721,14698,名詞,指愛管閒雜事情的人。
10723,14700,名詞,指人的神志、思維和心理狀況。
10726,14704,名詞,在負責的管區內，執行例行巡邏勤務的警察。
10731,14709,名詞,奴才。以前的人在搬運物品的時候需要使用繩子來綑綁，這種繩子稱為「箍絡索」，所以「箍絡」被引申有「搬運工」的意思，而後才再被引申成「奴才」的意思。
10732,14710,名詞,糯米磨成漿後，裝在布袋裡頭，壓上石頭把水分過濾掉，使米漿變成固體狀，可用來搓湯圓或做年糕的材料。
10733,14711,名詞,做粿的時候所使用的樹葉，有的用香蕉葉，有的用月桃花的葉子。
10734,14712,名詞,各種、各式。
10735,14713,名詞,客家粽。將糯米磨成漿壓去多餘水分，之後將炒過的餡料包入，再以粽葉包裹。閩南粽與其不同處在於用生米去蒸煮。
10738,14717,名詞,一種計算數目的工具。長方形，四周有框，早先框內每桿貫木珠七枚，中間用橫梁隔開，上二下五。現今的多改為五枚，上一下四。
10739,14718,名詞,粽葉。
10742,14721,名詞,依據人物、事物的品名、性質或特點而分的類別。
10744,14723,名詞,掛在牆壁上用來存放乾淨筷子的籠狀容器。
10745,14724,名詞,以繩線縱橫交錯編成的捕獵工具，也用來泛稱外貌或功能相似的物品。
10745,14726,名詞,指網際網路。
10748,14729,名詞,繡有吉祥圖案的紅綾布，喜慶時掛在門楣上。
10753,14736,名詞,動物的下肢。
10757,14740,名詞,網子。用線或繩子所編成，用來捕捉動物的器具。
10758,14741,名詞,衛生紙。
10761,14744,名詞,魚肚肉。這個部位的肉有豐富的油質，肉質特別可口。
10764,14747,名詞,罰款。強制違法的人繳納一定的金錢做為懲戒的處罰，是刑罰上五種主刑中最輕的一種。
10767,14750,名詞,蹄膀、肘子。豬後肢的上面部位，肉多且富脂肪，常拿來紅燒。
10768,14751,名詞,泌尿系統中儲存尿液的器官。為肌肉與膜質形成的囊，呈卵圓形，位在骨盤腔的前方和腹腔的下方。又作「小肚」(sió-tōo )。
10771,14754,名詞,開列違規事項及處分方法的憑單。
10772,14755,名詞,罰金。對違反法規的人所處罰的金錢。
10776,14759,名詞,細滑有文綵的織物。用來比喻奢華的衣著。
10777,14760,名詞,拖油瓶。再嫁婦女帶到後夫家的子女。
10779,14762,名詞,以鹽醃製的魚蝦、肉類。
10780,14763,名詞,濃稠的東西。
10781,14765,名詞,配合音樂或節奏來活動身體的一種藝術。
10782,14767,名詞,草本植物。葉色青，長而扁平，根稱「蒜頭」(suàn-thâu)，是常見辛香料，莖葉稱「蒜仔」(suàn-á)，是常見配菜。
10784,14769,名詞,以草莖或竹子編成，用來坐臥的墊子。
10787,14776,名詞,蓋子。物品上面的覆遮物。
10788,14777,名詞,在舞廳中以伴舞為業的女子。
10789,14778,名詞,蒜苗。生吃味道略帶辛辣，適合搭配香腸、烏魚子等食物，或者和其他肉類爆炒，都非常爽口。
10790,14779,名詞,蒜薹。根莖類。青大蒜於留蒜種結成鱗球時，會先長出花，當花梗長達五十到七十公分處，會另生花薹，長出花苞。花梗細長，呈青綠色，梗莖實心不中空，在花苞未開時採此株花梗食用，此梗即為「蒜仔花」。是近來才有的食用菜種，價格昂貴。
10791,14780,名詞,劇場內供演員表演的地方。
10792,14781,名詞,人體心臟和橫膈膜之間的部位。舊說以為是藥效無法到達處。引申為病症已達難治的階段。
10792,14782,名詞,位於肩背部的穴道，約在背部第四胸椎棘突起下方外側三寸處的穴道。
10794,14784,名詞,蒜泥。將大蒜去皮磨碎而成的調味料，加入醬油調和之後，可用來做沾醬。
10798,14788,名詞,大蒜。草本植物。多生於暖地原野間，葉長而有微稜，色多淺綠，氣微臭，大蒜的鱗莖各瓣攢聚為一，形如頭狀，所以稱為「蒜頭」。
10799,14789,名詞,傳統中醫把藥物浸於麻油內，再放於鍋中煎熬、去渣至濃稠狀。加入黃丹拌勻，離火後等藥物凝固，而放置涼水中去火毒，即成膏藥。使用時先加熱使其軟化，平鋪於布或薄油紙上，再貼上患部。
10800,14790,名詞,供人跳舞的娛樂場所，大多具有營業性質。
10801,14791,名詞,蜂蜜、花蜜、糖膏或是像蜂蜜一樣甜的東西。
10804,14798,名詞,歐美的習俗。新婚後的三十天內，每天照例飲用蜜糖水或蜂蜜酒，故稱為「蜜月」。後泛指新婚後的第一個月。
10805,14799,名詞,日蝕、日食。當月球運行到太陽與地球的中間時，太陽的光被月球遮擋住部分或全部的現象。又作「日蝕」(ji̍t-sit)。
10806,14800,名詞,月蝕、月食。地球運行到太陽與月球之間，三者正好成一直線時，地球陰影遮蔽月球，使月亮上出現黑影的現象。又作「月蝕」(gue̍h-sit)。
10809,14803,名詞,節肢動物。分頭胸部、腹部，有腳四對，肛門前有瘤狀突起之紡績器，由此抽絲織網，捕食昆蟲。
10810,14804,名詞,蜘蛛所結的網。
10811,14805,名詞,衣物的下襬。
10813,14809,名詞,表明決心的言詞。
10814,14810,名詞,表明決心的言詞。
10816,14812,名詞,用口頭表達的話。
10817,14813,名詞,用口頭表達的話。
10818,14814,名詞,格言、教條。
10819,14815,名詞,差錯。
10833,14835,名詞,人類用嘴說出來的話，由語音、語彙和語法所組成，是表情達意、傳遞思想的重要工具。
10835,14837,名詞,用以解釋的語言或文字。
10836,14838,名詞,語詞、語句形成的規律。
10837,14839,名詞,用言語勸說他人的人。
10840,14842,名詞,錯誤的了解。
10854,14863,名詞,一種帶有強烈刺激性的食品。
10859,14872,名詞,一種微生物，為真菌類，可將糖分解為酒精與二氧化碳。
10861,14875,名詞,含有大量活微生物及酶類糖化發酵劑。
10861,14876,名詞,製作湯圓時，將糯米團「粞」(tshè)，取一小塊先蒸熟，便成為像「粿」(kué)一樣且具有黏性的「酺」(pôo)，再將它揉入「粞」(tshè)當中使其均勻，就可以用來搓成湯圓。
10864,14879,名詞,餅狀、片狀的金屬板或建材。
10865,14881,名詞,金屬名稱，具有白色的金屬光澤。曾為貨幣材料的一種，現在多製作為用具、飾品。
10865,14882,名詞,泛稱具有白色光澤的金屬、物品、顏色等。
10866,14883,名詞,剪刀。
10871,14888,名詞,一種微生物，是子囊菌類的一種單細胞菌，可使糖分解為酒精和二氧化碳。用粳米浸水，加麴少許，讓它發酵，再加水讓它發熱。可用來釀製紅糟、豆腐乳等等。
10875,14892,名詞,銀白色。
10876,14893,名詞,一種金融機構。以存款、放款、匯兌為主要業務，或兼事票券經理、紙幣兌換、代理國庫之出納等業務。
10878,14895,名詞,小鬼、小鬼頭。對小孩不客氣的稱呼。
10880,14898,名詞,銅板。銅製的錢幣。今多泛稱硬幣。
10883,14902,名詞,本指物體重量的大小，引申為指事務的緩急或重要性。
10886,14905,名詞,冥紙。焚化給死者使用的紙錢。
10887,14906,名詞,別針。一種用來將物品暫時固定或密合的針。
10888,14907,名詞,剪刀。
10889,14908,名詞,鈔票。也就是紙幣。
10890,14909,名詞,竹筍經由發酵、曬乾等過程，製成帶有酸味口感的「酸筍」。
10893,14912,名詞,鋁。金屬元素之一。其色銀白，質輕不鏽，富延展性，傳熱及導電性極佳。可加工製成電線、鋁箔、日常用器皿等。
10896,14915,名詞,血統關係較為疏遠的親戚。
10897,14916,名詞,哀悼死者的對聯。
10900,14919,名詞,螺旋梯。
10903,14922,名詞,金屬名稱，具有淡紅色的光澤，有延展性，是製作容器、塑像及電線等物品的良好材料。
10904,14923,名詞,刀背。
10905,14925,名詞,戴在犯人手上的刑具。
10906,14926,名詞,樓房、高聳的彩棚。
10908,14930,名詞,漏洞、小縫。
10911,14935,名詞,空的鐵製罐頭罐子。
10912,14936,名詞,銅製成的線狀物，因為導電佳，所以可作為電線等用途。
10913,14937,名詞,銅幣。古代銅質硬幣，多為圓形而中有方孔。
10916,14943,名詞,領子、衣領。衣服圍護頸部的部分。
10917,14947,名詞,用米粉或麵粉做成的扁平狀食品。
10917,14948,名詞,扁平狀像餅一樣的東西。
10918,14949,名詞,誘捕動物的食物，也引申為引誘人的事物。
10919,14950,名詞,人的精氣。
10920,14951,名詞,傳說中的百鳥之王，為象徵祥瑞的鳥。
10922,14953,名詞,國家構成要素之一。指國家所統轄的土地，為國家行使主權的範圍，包括陸地、領水、領海及領空。依據國際法，他國不得任意侵犯。
10923,14954,名詞,骰子。一種遊戲或賭博用的小方塊。六面分別刻上一、二、三、四、五、六點，一、四漆紅色，其餘為黑色。
10924,14955,名詞,餅屑。
10926,14957,名詞,販賣糕餅的商店。
10927,14958,名詞,堤防、河堤。沿河或海邊修築的高岸，用以防水患。
10929,14960,名詞,傳說中的百鳥之王，雄的稱為「鳳」，雌的稱為「凰」，為象徵祥瑞的鳥。
10930,14961,名詞,木本植物。夏季盛開，花瓣五片，焰紅色。主供觀賞，為極佳的行道樹及庭園樹。
10931,14962,名詞,穿著西服時，繫在襯衫衣領上用來裝飾的長條布塊。
10934,14965,名詞,本義指衣服的領子和袖子。後來用指國家或團體的領導人。
10935,14966,名詞,附於人體的精神靈氣。
10937,14969,名詞,鼠蹊部。指大腿與下腹部相連的地方。
10938,14970,名詞,人體的呼吸及嗅覺器官。
10938,14972,名詞,鼻涕。
10938,14973,名詞,物體突出而像鼻子的部分，如草鞋、木屐等夾腳鞋帶的繫紐。
10938,14974,名詞,嗅覺。
10938,14975,名詞,小孔。
10942,14983,名詞,鼻腔黏膜因發炎現象所分泌的無色水狀黏液。
10943,14984,名詞,鼻子。
10944,14985,名詞,五官。人面目上的眼睛、嘴巴、鼻子等器官的總稱。
10946,14987,名詞,鼻孔。鼻子的孔道，為呼吸時氣息出入的通道。
10947,14988,名詞,鼻息。從鼻腔中所呼出的氣息。
10949,14990,名詞,堆積在鼻腔裡面的分泌物。
10950,14991,名詞,鼻腔中尚未乾燥成塊的鼻屎。
10951,14992,名詞,發音時，口腔的氣流通路阻塞，軟顎和小舌下垂，氣流改從鼻腔逸出，即成為鼻音。
10953,14994,名詞,鼻梁下端高起處，靠鼻孔的尖端。
10954,14995,名詞,整數。沒有零頭的數目。
10955,14996,名詞,鼻瘜肉。指鼻腔內的贅生物，形狀像葡萄子，顏色呈灰白色或淡紅色，半透明狀，摸起來感覺柔軟但卻不會痛。
10956,14997,名詞,鼻尖兩旁的部分。
10957,14998,名詞,事物所值的具體金錢數。
10957,14999,名詞,人、事、物所值的抽象地位或身分。
10960,15003,名詞,戲。
10962,15005,名詞,武器名，兩面有刃，中間有脊，附有握柄。
10963,15007,名詞,箭竹。禾本植物。竹子的一種，較其他竹子為細小，分布於臺灣低海拔山區；嫩筍亦可供食用。
10964,15008,名詞,物品的價值或評斷事物標準的程度。
10966,15011,名詞,戲劇等表演藝術的演出場所。
10967,15012,名詞,箭筍、箭竹筍。箭竹所生出來的筍子。味道苦中帶甘。
10970,15015,名詞,價格。以貨幣所表現的商品價值。
10971,15016,名詞,價格、價碼。
10974,15019,名詞,音樂節奏中的弱拍，即「板眼」的「眼」。
10978,15024,名詞,被蚊蟲類叮咬後的腫泡。
10981,15031,名詞,懸著、垂下的東西。
10982,15032,名詞,臨時性的市集。
10983,15033,名詞,書畫用的黑色顏料。
10984,15035,名詞,木匠用來打直線的器具。從墨斗中拉出墨線，放在木材上，兩頭固定繃緊，提起墨繩趁著彈力就打上了黑線。
10984,15036,名詞,有的地區用來指稱一種海中生物，也就是「墨魚」。
10985,15037,名詞,墨汁。
10985,15038,名詞,裝在鋼筆等書寫工具內的各種顏色的水。
10985,15039,名詞,比喻學問。
10986,15040,名詞,為點綴周遭環境而裝設的人造噴水設備的池子。
10987,15041,名詞,鐘擺。
10987,15042,名詞,墜子。配戴在身上或裝飾在器物上的懸垂的飾物。
10989,15044,名詞,墨水。寫毛筆用的黑色液體，或泛稱寫字、印刷用的有色液體。
10991,15046,名詞,節拍。指南管音節中的拍子符號。
10992,15047,名詞,藉噴射氣體作為推進動力的飛機，引擎構造簡單，速度快。
10994,15049,名詞,烏賊。
10996,15051,名詞,用硝酸纖維素、樹脂、顏料、溶劑等製成的人造漆，耐水、耐機油、外乾、色澤好，可用來塗飾汽車、家具、飛機、皮革等。
10998,15053,名詞,硯臺。磨墨的石座。一端有窪下的硯池，用以盛裝墨水。
10999,15054,名詞,噴在物體上的水滴或斑點。
10999,15057,名詞,斑點。
11001,15059,名詞,用來量取垂直的工具。砌牆時將繩上綁重物垂墜，便可取直。
11006,15066,名詞,臨時搭建的、簡陋的小屋或棚子。
11010,15072,名詞,形狀狹長而下垂的旗幟，多用於喪事之中。
11011,15073,名詞,祭祀神明的建築。
11012,15074,名詞,製造商品或修理器物的場所。
11015,15079,名詞,內裝火藥，具殺傷力和毀滅性的爆炸物。
11017,15082,名詞,光線被遮擋而造成的陰暗處。
11017,15083,名詞,人、物品等的形象或圖像。
11017,15086,名詞,攝影器材拍攝的影像。
11018,15087,名詞,正直的行為，善良而有修養的品行。
11019,15088,名詞,廚師。掌理廚房烹飪事務，並以此為職業的人。
11020,15089,名詞,廟祝。主管廟內香火事務的人。
11023,15092,名詞,電影。
11023,15093,名詞,拍攝成電影的底版膠片。
11024,15094,名詞,簡陋的屋舍。
11025,15095,名詞,旛。一種狹長而下垂的旗幟。
11026,15096,名詞,小廟。
11029,15099,名詞,指小孩子在剛入小學的時候所特別安排的一種課程，與「讀書」相對。
11030,15100,名詞,寺廟、寺院。佛寺的通稱。
11033,15103,名詞,一種宣傳的方式。以文字、圖片或影片介紹商品，藉由報章雜誌的登載，電視和收音機的傳播或印成傳單小冊散發，以吸引顧客，達到促銷目的。
11034,15104,名詞,在屋內專供烹調食物的地方。
11035,15105,名詞,沒有利用價值的物品，後來也被用來當作罵人語。
11039,15109,名詞,廟宇前面的大廣場。
11043,15113,名詞,沒有意義的話。
11044,15114,名詞,出殯時書寫死者名籍的白布旗幟。
11047,15117,名詞,專供在無線電中廣播的戲劇。特別著重音樂配合和音響效果等藝術方式，以創造聽覺形象，展開劇情。
11048,15118,名詞,電影的舊稱。
11052,15122,名詞,用來鑽孔的工具。
11060,15134,名詞,用手指撚成的細長物。
11075,15150,名詞,一種球類運動。起源於法國的一種草地木球遊戲，經過改良演變，目前的遊戲方式為在長方形的球檯上放置一或二顆白色母球以及數顆紅色或其他顏色的子球，擊球者以球桿直接撞擊母球來碰撞其他子球，進入球檯四周的袋子而得分。
11089,15164,名詞,用竹竿或木頭做成的撐船工具。
11093,15168,名詞,賭具的一種，用銅製的盒子裝骰子，加上蓋子，搖動後看骰子的數目來決定輸贏。
11095,15170,名詞,螺紋鑽。鋼製、木工專用的的鑽孔工具。
11096,15171,名詞,轆轤錐。轆轤是指利用滑輪原理製成的汲水用具，轆轤錐則是指支撐轆轤的中心橫槓。使用時雙手反覆搓弄旋轉上面的圓錐木頭，而使下方的鐵鑽旋轉穿透木材。
11105,15184,名詞,帳目。
11106,15187,名詞,數目的總稱。
11106,15188,名詞,氣運、命運。
11108,15190,名詞,划船時，在船旁撥水讓船前進的用具。
11109,15191,名詞,放置牲畜飼料的器具。
11109,15192,名詞,盛裝液體的長方形或正方形容器。
11110,15194,名詞,和諧動人且有規律、有節奏的聲音。
11112,15196,名詞,仇敵，與己方有仇恨而相對抗的人。
11114,15199,名詞,能力足以相抗衡的對手。
11117,15202,名詞,槳。在船旁撥水使船前進的用具。
11119,15204,名詞,帳目。記入帳簿的收支項目。
11120,15205,名詞,蒔田管。一種用竹管或鐵皮作成，套在拇指上，朝外的部分呈尖刃形，專門用來插秧的農具。
11121,15206,名詞,表示數目的文字或者符號。
11123,15208,名詞,管理銀錢出入的地方或人。
11130,15215,名詞,帳單。記載帳目的單據。
11132,15217,名詞,總額的多寡。
11133,15218,名詞,為演奏樂曲所組成的隊伍。
11134,15219,名詞,幸福安樂的園地。
11134,15220,名詞,供人遊樂的場所。
11141,15227,名詞,討論數量、形狀和它們之間關係的科學。其中包括了算術、代數、幾何、三角、解析幾何、微分、積分等。
11143,15229,名詞,豬頸部分的肉。
11144,15230,名詞,帳房。指管理錢財出入的人或地方。
11145,15231,名詞,帳目。一定的金錢數目。
11146,15232,名詞,帳本、帳簿。記載金錢貨物出入的簿冊。
11149,15236,名詞,兩層以上的房屋。
11149,15237,名詞,指樓房的其中一層。
11150,15238,名詞,指與事物本體無關的事物。
11151,15240,名詞,對一定數量的工程或商品，照一定的標準所估定的價目。
11152,15242,名詞,木本植物。樹木本身有特殊的香氣，葉卵形或橢圓形，花小色淡黃，果實成熟時為紫黑色，可煎為樟腦，有強心、解熱、殺蟲等功效，其材質硬而聳直，紋理細緻，可供建築、雕刻，或製成家具。
11153,15243,名詞,樹脂。
11154,15244,名詞,模子。製造器物的容器，凹陷處通常刻有花紋。
11154,15245,名詞,外型、輪廓。
11154,15246,名詞,指人身上長出來的塊狀或圓球狀的小腫塊。
11155,15248,名詞,形式、形狀。
11155,15249,名詞,做為標準的物品。
11156,15250,名詞,泛稱較濃稠的液體。
11158,15255,名詞,洗米後剩餘的水，呈乳白色，可用來清潔或飼養家畜。
11158,15256,名詞,廚餘、餿水。因早期農家常將洗米剩餘的水與廚餘放在一起，所以也衍申指廚餘。
11159,15257,名詞,洗米後剩餘的水，呈乳白色，可用來清潔或飼養家畜。
11160,15258,名詞,樓房的簡稱。
11161,15259,名詞,樟樹。木本植物。樹木本身有特殊的香氣，葉卵形或橢圓形，花小色淡黃，果實成熟時為紫黑色，可煎為樟腦，有強心、解熱、殺蟲等功效，其材質硬而聳直，紋理細緻，可供建築、雕刻，或製成家具。
11162,15260,名詞,樓房。兩層或兩層以上的房子。
11163,15261,名詞,經過處理，可以長久保存原樣的動、植、礦物等。
11164,15262,名詞,頂樓。樓頂上的平臺。
11164,15263,名詞,頂樓。多層樓房的最高一層。
11166,15265,名詞,洗米後剩餘的水，呈乳白色，可用來清潔或飼養家畜。
11171,15270,名詞,餿水桶。早期農家會將洗米水與廚餘一併置於桶中以餵食家畜。
11172,15271,名詞,上下樓用的階梯。
11175,15274,名詞,衡量事物的準則。
11176,15276,名詞,用樟樹的根幹枝葉提煉出來的酮類白色結晶，現已可由人工合成。主要用來製成興奮劑、防蟲劑、防腐劑、局部止癢劑和火藥等等。
11178,15278,名詞,指人或物的容貌或外形。
11179,15279,名詞,榜樣、楷模。
11179,15280,名詞,木製的模型，為製作器物的母型。
11180,15281,名詞,商標。為自己所生產製造或販售的商品，用文字或圖畫作成特定標記，以防止他人誤認或冒用。
11181,15282,名詞,工程圍標的主事者，有時也指得標的人。
11183,15285,名詞,深水池。
11184,15286,名詞,精液。
11184,15287,名詞,引申為無聊、無用的事，加在詞句中使之成為粗俗的用語。
11184,15288,名詞,用於動詞或形容詞後，有不愉快或不合理的意思。
11191,15299,名詞,對於某種事物專精熟練的人。
11192,15300,名詞,藉熱力燙平衣料的金屬器具。
11193,15301,名詞,小水池。
11195,15303,名詞,熟人。認識、熟識的人。
11196,15304,名詞,一種印刷加工方法。將金箔放於預定位置，再將刻有圖案、文字等金屬印版熱加壓，把金箔燙上。通常用於精裝書封面或賀卡等。
11197,15305,名詞,因潮汐漲落而產生海水流動的現象。
11197,15306,名詞,時事、人情和社會風氣等變動發展的傾向。
11200,15310,名詞,稜角絲瓜、角瓜。瓜果類。是澎湖特產的絲瓜，外表有條溝狀花紋，下大上小，呈圓錐狀。質脆味美，和臺灣絲瓜大相逕庭。因為有十個稜角，所以又叫「十捻」，和「雜念」諧音，有句歇後語「澎湖菜瓜──十捻」，就是從這個意象引申出來的。
11201,15311,名詞,春捲。將麵糰攤薄烙熟後，捲包五花肉絲、豆芽、香菜、紅蘿蔔絲及筍絲等製成的食品。
11202,15312,名詞,鍛鐵。經過冶鍊以減少含碳量的鐵。
11205,15318,名詞,為了表揚或鼓勵而發的物品或金錢。
11205,15319,名詞,博彩或遊戲中贏得的金錢。
11206,15320,名詞,皮膚或黏膜上的潰瘍的總稱。
11207,15321,名詞,皮膚表面或筋骨之間的贅生物。
11210,15326,名詞,一種盛放物品的淺底器皿。
11210,15327,名詞,物品行銷各層次。
11210,15333,名詞,形狀像盤的東西。
11211,15334,名詞,夏天。一年四季中的第二季。
11212,15335,名詞,夏天。一年四季中的第二個季節，一般而言氣候較熱。
11214,15337,名詞,盤子。盛放物品的淺底器皿。
11215,15338,名詞,中國神話傳說中開天闢地的人。
11216,15339,名詞,鑽石。一種硬度極高的礦石，可用來切割玻璃，光色好的則用作貴重的裝飾品。
11217,15340,名詞,瘠田、薄田，貧瘠的田地。
11222,15345,名詞,為獎勵而頒發的證書。
11223,15346,名詞,為獎勵而發給的現金。
11224,15347,名詞,中醫認為人體內因火氣大所引起生瘡發病的現象。
11225,15348,名詞,指流行性急性傳染病的統稱。
11226,15349,名詞,地球表面位在赤道與南北回歸線之間的地帶。此地帶受到太陽照射能量最多，全年溫度高且變化不大。
11227,15350,名詞,皺紋。指人體皮膚上或物體表面上的摺痕。
11229,15353,名詞,戲稱人瘦得像猴子。
11230,15354,名詞,以鑽石為刀尖，用來切割玻璃的刀具。
11231,15355,名詞,中暑。曝露於太陽底下所引起的病症，出現痙攣、昏睡、體溫升高等症狀。
11233,15357,名詞,熱咳。一般人認為咳嗽無痰即為熱咳。通常熱咳者會口乾、喉癢、痰少，但痰黃且濃稠，嚴重時還會呈現黃綠色。
11241,15369,名詞,禾本植物。高約三、四尺，結實累累成穗，有水稻和旱稻兩種。果實呈橢圓形，有硬殼，去殼後就變成米。是一種重要的糧食作物。
11242,15370,名詞,本意指禾本或草本等植物的莖稈。
11242,15371,名詞,後來大多借指未完成或已完成的文字、圖畫等。
11246,15376,名詞,燒製陶、瓷、磚、瓦等的爐灶。
11246,15377,名詞,用火燒熱的小土石堆，可將食物埋在裡面燜熟。
11247,15378,名詞,竹鞭。
11248,15379,名詞,籜。竹莖外、筍殼外或是植物莖稈外的硬葉。
11249,15380,名詞,一種形狀細長，前端尖銳，可搭在弓上發射的武器。
11250,15381,名詞,收納東西的器具。
11251,15383,名詞,砝碼。以天平或磅秤稱物時，用來計算重量的標準器。由銅鉛等金屬製成，有輕重大小之別。
11251,15384,名詞,炸藥。
11253,15386,名詞,磅秤。以金屬做成，底座上有承重的金屬板，用來衡量物體輕重的器具。
11254,15387,名詞,竹枝或竹條。有些人會用來打小孩或做教鞭。
11255,15388,名詞,箱子。盛裝物品的方形器具。
11256,15389,名詞,用油炸過的豬皮，使它不再堅韌，組織變鬆脆，是一種可保存較久的食物。
11259,15392,名詞,隧道。以火藥進行爆破來貫穿山脈而成的通道。
11259,15393,名詞,涵洞。道路與河道、天然排水溝或渠道相交會時，所預留的空間，以利通水的暗渠或暗管。
11261,15395,名詞,晒穀場。用以曝晒稻穀的場地。
11262,15396,名詞,稻子收成之後剩下的枯莖，可以用來編織、蓋屋、造紙或做為飼料、燃料等。
11263,15397,名詞,用稻草做成的假人，樹立在田間，用來驅逐啄食農作物的鳥類。也用來比喻徒具外表，卻無內涵、功用的人、物。
11267,15402,名詞,儀錶。用來測量物品的器具，上面具有表示度數、時間等的數字或符號。
11268,15403,名詞,在海港、河川或運河沿岸，用以停靠船隻，裝卸貨物與上下旅客的地方。
