詞目id,義項id,詞性,解說
3464,4839,名詞,食品。把黃豆或黑豆泡透煮熟後，經過發酵而製成。可當菜肴的調味料。
3467,4842,名詞,雇員、伙計。
3468,4843,名詞,車票。乘車所用的憑據票證。
3469,4844,名詞,公共汽車上負責剪票或收票的服務員。源自日語。
3471,4846,名詞,芋的莖，可食用。
3472,4847,名詞,豆芽菜、豆芽。指黃豆或綠豆等豆類植物的種子浸在水中所發的芽，可以食用。
3474,4849,名詞,江湖郎中、江湖術士、蒙古大夫。指未受過正式的醫學訓練而幫人看病的人，通常醫術不精。
3475,4850,名詞,由語言表達的詞句或語彙。
3476,4851,名詞,地方、一帶。
3478,4854,名詞,臺灣著名的小吃。將地瓜粉加入芋泥中製成。芋圓以滾水煮熟後，通常加入糖水之中食用。
3479,4855,名詞,觀點、看法、主張、意見。
3480,4856,名詞,赤腳。沒有穿著鞋襪的光腳。
3481,4857,名詞,蒙古大夫。指未受過正式的醫學訓練而幫人看病的人，通常醫術不精。
3484,4861,名詞,道士在舉行法事的時候所使用的法器，可用來召集神軍和驅邪。
3485,4862,名詞,一種流行於閩南及臺灣的表演戲劇。劇目取材來自民間故事，音樂則以閩南流行的民歌小調為主，是迎神廟會重要的活動。
3486,4863,名詞,臺灣小吃的一種。以米漿和芋頭為主要材料，蒸熟後食用。
3487,4864,名詞,豆餅。用壓榨豆油剩下來的渣滓，壓製成每個約三、四十斤的圓餅，可做肥料或飼料。
3489,4866,名詞,用芋頭、在來米、紅蔥頭、蝦米等，蒸製而成的一種食品。形狀如弧形而得名。
3490,4867,名詞,黃豆磨成豆汁之後，再加工製成的食品。
3491,4868,名詞,一種防止東西腐敗的藥劑。
3492,4869,名詞,魚類。鯨鯊，體長在八到十五公尺之間，有時可達十八公尺，是現存最大型的海洋魚類。因肉質白而細嫩如豆腐，在臺灣稱之為「豆腐鯊」。
3493,4870,名詞,指人類所說的話，是用來表達情意、傳遞思想的重要工具。
3494,4871,名詞,豆麴。把黃豆或黑豆浸在水中泡透，然後蒸熟或煮熟，經過最後的發酵即完成。再加工便可製成醬油或味噌。
3495,4872,名詞,豆類榨油之後剩下來的殘渣，壓成圓餅狀，可以當飼料或肥料。
3496,4873,名詞,身分。一個人社會地位的價值。
3496,4874,名詞,賣身錢。
3496,4875,名詞,指擁有的財富。
3497,4876,名詞,言談。表示意見的言語。
3498,4877,名詞,車的輪子。
3499,4878,名詞,犬齒、虎牙。形狀像狗的牙齒，適於齧裂強韌食物。
3500,4879,名詞,剎車。使車子停止行進的機件。手剎車叫「手擋」(tshiú-tòng)，腳剎車叫「跤擋」(kha-tòng)。
3501,4880,名詞,車資。乘車所付的費用。
3502,4881,名詞,兩堵牆相接連的凹角。
3502,4882,名詞,地方上的某一處，常被引用做地方上的領袖人物或是黑社會老大。
3503,4883,名詞,把豆子磨碎，用濾布過濾之後的豆渣。可以餵豬或當肥料。
3504,4884,名詞,把豆子煮熟搗爛後，加入糖、油等調味料所做成的食品，經常用來做糕餅點心的餡。
3505,4885,名詞,車站。
3505,4886,名詞,車子的前頭部分。
3506,4887,名詞,班車。有固定路線並按排定時間開行的車輛。
3508,4889,名詞,身體。
3509,4890,名詞,身邊、身旁。
3509,4891,名詞,身上、隨身。
3510,4892,名詞,味噌。用黃豆發酵所製成的醬。
3511,4893,名詞,日本味噌湯。一種以豆腐、柴魚、味噌等為材料的湯。
3512,4894,名詞,用綠豆、豇豆磨成粉後，再加工製成的麵條形食品。
3513,4895,名詞,豆類植物的藤蔓。
3514,4896,名詞,魚類。腹部呈白色，體側扁而鮮紅，身體多處部位有黃色斑點或斑紋。身長約二十到二十五公分，遍布臺灣四周的海域，以小魚、小蝦及透抽等為食。是屬於較高級的魚類。
3515,4897,名詞,身高。
3516,4898,名詞,豆腐乳。
3517,4899,名詞,人的軀體。
3521,4908,名詞,人類的所作所為及自然界的一切現象或活動。
3523,4912,名詞,騙子。
3530,4934,名詞,用來幫助說明某些狀況或道理的事物。
3530,4935,名詞,規則。
3530,4936,名詞,統計中合乎條件的事例。
3530,4937,名詞,風俗。
3531,4939,名詞,口供、供詞。
3533,4941,名詞,美人。
3535,4943,名詞,當事人。與事情有直接關係的人。
3536,4944,名詞,騙子。
3537,4945,名詞,來生、下輩子。
3539,4949,名詞,破例。在一般原則、常規之外。
3542,4952,名詞,僕人、傭人、手下。
3545,4957,名詞,事項、事情。
3546,4958,名詞,小名、奶名。
3556,4969,名詞,好消息。
3559,4972,名詞,總務。
3560,4973,名詞,辦理事務及業務的處所，通常用來指稱與法律、政治或經濟等有關的機構。
3561,4974,名詞,道理。事物或事情的道理。
3563,4976,名詞,好日子。
3563,4977,名詞,結婚的日期。
3566,4980,名詞,具有一定的目標、規模組織或對社會發展有影響的活動。
3566,4981,名詞,泛指一個人所經營的企業。
3567,4982,名詞,底細。指人的身世背景或物品的來源。
3567,4983,名詞,引申為收入。
3568,4984,名詞,鍍鋅鐵的通稱，也就是一般所說的白鐵。
3569,4985,名詞,鐵皮。將低碳鋼滾壓成各種厚度的金屬片，常塗漆以防鏽蝕。
3570,4986,名詞,鐵線、鐵絲。
3571,4987,名詞,真相。事情的真實情形。
3573,4989,名詞,出席的嘉賓。
3574,4990,名詞,來源、背景。
3576,4992,名詞,平劇。舊時流行於中國大陸各地的劇種。有近兩百年歷史，清末以北京最為盛行，故稱為「京劇」、「京戲」。民國之後改北京為北平，所以又稱為「平劇」。
3580,4997,名詞,笨蛋。愚蠢、呆笨的人。
3581,4998,名詞,兔子。
3581,4999,名詞,十二生肖排序第四的生肖。
3586,5007,名詞,器物。
3587,5008,名詞,可作為依據或模範的書。
3588,5009,名詞,初始、起源。
3593,5021,名詞,法度、規定。
3594,5022,名詞,可以用來作為憑證的票據。
3595,5023,名詞,可以用來作為憑證的票據。
3595,5024,名詞,書面文件。
3596,5025,名詞,指細而尖銳的東西。
3601,5036,名詞,小兵。
3601,5037,名詞,供驅遣、差役的人。
3601,5038,名詞,象棋的棋子。
3602,5039,名詞,古代卜筮所用的符號。相傳為伏羲氏所創，以陰爻、陽爻相配合，每卦三爻，形成八卦，八卦互相搭配，演為六十四卦。古人觀卦象以定吉凶。
3606,5047,名詞,父親的弟弟。
3606,5048,名詞,對父執輩中，年紀比自己父親小的人的尊稱。
3606,5049,名詞,稱呼丈夫的弟弟。
3606,5050,名詞,堂兄弟姊妹之間的關係。
3606,5051,名詞,對繼父的稱呼。
3607,5054,名詞,值得被揀選的優點。
3609,5057,名詞,六斑刺河豚。魚類。全身除吻端和尾鰭外，密佈長棘，頭部的棘較身體上之棘為長，無毒，味道鮮美，是饕客喜歡品嚐的一種海鮮。
3611,5059,名詞,指初中一年級。
3616,5064,名詞,稱謂。父親的叔父。
3617,5065,名詞,毛毛蟲。昆蟲名。泛指蝶類或蛾類的幼蟲，身體細長而柔軟，呈圓筒狀，外表分節，每環節的疣狀突起上生有短毛，顏色則視種類而異。
3618,5066,名詞,兩邊、兩方或兩造。
3619,5067,名詞,兔子。哺乳動物。草食性，耳大，尾短且上翹，上脣中裂，後腿比前腿長，善跳躍。毛色為灰、白或褐色不等。性溫和且外型可愛，故常被飼養為寵物。
3621,5069,名詞,荊棘。木本植物。叢生而多刺的灌木。
3622,5070,名詞,小兵。象棋的棋子。
3622,5071,名詞,指小人物、無足輕重的人。
3623,5072,名詞,哀杖。出殯時，孝子手中所拿的杖子。
3625,5074,名詞,胡瓜、黃瓜。瓜果類。瓠果細長，通常為長形或卵形，表面有小刺，大小隨品種而異。
3631,5082,名詞,植物名。有刺，多種植在住宅周圍防盜，竹身肉厚強韌，可作生活器具或家具等。
3632,5083,名詞,刺竹所生的筍子，帶有稍許的苦味，少人食用，食用前必須先將苦水煮出來，或是作成「酸筍」(sng-sún)，以避免苦味。
3634,5085,名詞,堂兄弟。稱謂。稱父親兄弟的兒子。
3635,5086,名詞,堂姊妹。
3636,5087,名詞,指堂兄弟姊妹的關係。
3638,5089,名詞,在事情進行的程序中，屬於開始的階段。
3643,5094,名詞,公私機關分類彙存的文件。
3644,5095,名詞,統一規定式樣的服裝。
3645,5096,名詞,野草莓。
3647,5098,名詞,經制定而為大家共同遵守認同的辦事準則。
3648,5099,名詞,母老虎。指凶悍的女人。
3648,22221,名詞,菊科鬼針草屬，是一種民間的藥草。果實上長有刺毛，易附著於人的衣物或動物身上藉以散布、繁衍。
3650,5102,名詞,雙方之間因利害關係，共同訂立的條約。
3653,5105,名詞,叔侄。
3660,5112,名詞,最低的層次。
3669,5121,名詞,為促進某種共同事業的發展而組成的群眾團體。
3673,5126,名詞,胃酸。胃液中所含的鹽酸。可殺死食物中的微生物，胃內的食物就在此酸性的情況中被消化。
3681,5134,名詞,公開且莊重的儀式。
3688,5142,名詞,氣味、味道。
3693,5155,名詞,上級對下級的指示。
3693,5156,名詞,宿命、命運。
3694,5158,名詞,宿命、命運。
3694,5159,名詞,生命、壽命。
3699,5170,名詞,以梵文發音的偈語或咒語。
3700,5173,名詞,被綁成一捆一捆的東西。
3701,5175,名詞,一種用陶土燒製成的鍋，通常做為烹煮食物的鍋具，亦可當成花盆。
3703,5178,名詞,未經窯燒成陶瓷器的土器，或是初具雛形的東西。
3704,5180,名詞,上對下的號令。
3705,5181,名詞,盆子、陶鍋。鍋盆之類可以用來盛裝食物的器具的總稱。
3715,5192,名詞,本義指德高望重的出家人，且為初受戒者之師表，其位階遠比一般比丘、比丘尼為高，在西藏，其權力地位僅次於達賴喇嘛及班禪喇嘛。而臺灣民間則普遍稱呼皈依三寶(佛、法、僧)的男性出家人為和尚。
3722,5200,名詞,用胡椒、薑黃、番椒、茴香、陳皮等的粉末所製成的調味品。色黃、味香而辣，以印度所產最為著名。源自英語curry。
3724,5202,名詞,殺人致死的案件。
3726,5204,名詞,味精。用豆、麥等物做成的白色結晶狀的調味品。
3727,5205,名詞,味精。
3728,5206,名詞,木本植物。常綠喬木。原產於東非阿比西尼亞，現多栽培於熱帶地區。高約四至六公尺，花白色。核果橢圓形，成熟時呈黃紅色或紫紅色，內含兩顆種子，即為咖啡豆，處理後再經烘焙並研磨成咖啡粉，可沖泡為飲料，有興奮神經之效，是一種流行的現代飲品。源自英語。
3729,5207,名詞,一種褐色系列的顏色，與咖啡的顏色相近。
3734,5212,名詞,環繞在物體四周的部分。
3741,5219,名詞,人天生注定的貧富禍福。
3755,5236,名詞,晚上。
3758,5240,名詞,單數。
3759,5241,名詞,稱謂。稱呼較自己年幼的女子。
3760,5242,名詞,稱謂。男子稱自己的正式配偶。
3761,5243,名詞,男人的側室、小老婆。
3761,5244,名詞,女子的謙稱。
3762,5245,名詞,稱呼伯父的妻子。
3762,5246,名詞,尊稱中年長輩的婦人。
3763,5247,名詞,稱謂。用來稱呼具有血親關係，比自己先出生的女子。
3763,5248,名詞,用來稱呼同輩中，年紀比自己大的女子。
3764,5249,名詞,稱呼具血親關係的同輩女性，較自己年長者。
3764,5250,名詞,敬稱同輩之中，無血緣關係，而年紀比自己長的女性。
3764,5251,名詞,具長者之風，有領導力的女性。
3764,5252,名詞,女性的玩伴。
3765,5253,名詞,稱呼父親的姊妹。
3765,5254,名詞,女人稱呼丈夫的姊妹。
3765,5255,名詞,指出家吃素或修行的女子。
3766,5256,名詞,指姓氏。
3767,5257,名詞,指姓氏。
3768,5258,名詞,稱謂。稱姑母的丈夫。
3770,5260,名詞,稱謂。稱呼姊姊的丈夫。
3771,5261,名詞,伯母。稱謂。面稱伯父的妻子。
3771,5262,名詞,媽媽。稱謂。稱自己的母親。
3771,5263,名詞,稱年長的女性。
3772,5264,名詞,姊姊。稱謂。稱同輩親友中長於自己的女性。
3773,5265,名詞,夜晚營業的市場。通常都是由一些賣小吃或是日用品的攤位集中在一起。
3776,5270,名詞,文職公務人員的最低官等，在簡任、薦任職等之下。
3778,5272,名詞,罵人骯髒或下流的用語。
3779,5274,名詞,髒話。
3781,5276,名詞,姊姊和妹妹的合稱。
3781,5277,名詞,稱呼輩分相同或身分地位相近的一群女性。
3781,5278,名詞,稱呼天主教或基督教的女性教友。
3782,5279,名詞,手帕交、姊妹淘。指一群情同姊妹，互相為伴的朋友。
3784,5281,名詞,指姑姑的子女與自己的親屬關係。
3785,5282,名詞,稱謂。泛稱姑姑或阿姨。
3786,5283,名詞,政治機關或團體中，接受法定委託、擔任特定事務的人員。
3787,5284,名詞,灰塵、塵埃。隨風翻飛的塵土。
3788,5286,名詞,稱呼未出嫁的女子。
3788,5287,名詞,指天主教和基督教中出家修道的女子，一般是不能結婚的。
3790,5290,名詞,送客辭。
3792,5292,名詞,蝙蝠。哺乳動物，外形像老鼠，四肢與身體之間有膜相連，類似鳥類的翅膀，所以能飛翔。眼睛小，視力弱，靠體內聲納系統發出的高頻率音波所傳回來的回聲來引導飛行，所以善於夜間活動。
3793,5293,名詞,伯祖母。稱謂。稱呼父親的伯母。
3794,5294,名詞,稱謂。稱祖父的姊妹或同輩女性親友。
3794,5295,名詞,過了適婚年齡而還沒有出嫁的女性，通常帶有負面意涵。
3796,5297,名詞,稱謂。稱自己妹妹的丈夫。
3797,5298,名詞,夜間的景色。
3798,5300,名詞,碧玉釧。臺灣亂彈戲中的吹腔曲目之一，以「雙𥰔」(兩支笛子)伴奏，是較細膩的曲目。
3799,5301,名詞,學校在夜間授課的部門。
3800,5302,名詞,夜工、晚班。在夜間從事的工作。
3801,5303,名詞,稱謂。以前岳家稱女婿叫做姑爺。
3802,5304,名詞,大舅子、小舅子。稱謂。妻子的兄弟。
3803,5305,名詞,單數。不能被二整除的數，如一、三、五等。相對於偶數而言。
3804,5306,名詞,異於尋常、令人無法理解的現象或事情。
3805,5308,名詞,穢氣。
3806,5309,名詞,指季節。
3807,5312,名詞,指孤魂野鬼。
3808,5313,名詞,官吏。
3808,5314,名詞,指生物身上有機能的部分。
3809,5315,名詞,政府機關中經過任命而且有一定等級以上的公職人員。
3810,5319,名詞,指婚姻中預約的信物或聘禮。
3814,5326,名詞,禽獸蟲鳥的巢穴。
3815,5328,名詞,水域邊緣高出水面的地方。
3815,5329,名詞,田地周圍高出的邊界。
3816,5330,名詞,布巾。
3817,5334,名詞,請柬。
3817,5335,名詞,供臨寫摹仿用的習字範本。
3818,5337,名詞,福分。
3819,5338,名詞,器物或物體的最下部分。
3819,5340,名詞,盡頭、末了。
3819,5342,名詞,殘餘的、剩餘的東西。
3819,5343,名詞,基礎、根基。
3819,5344,名詞,身世、背景、本質。
3821,5347,名詞,販售各類商品的店舖。
3822,5348,名詞,無父無母無兄弟姊妹、親戚的光棍。
3825,5352,名詞,照相時用來感光的膠片。
3826,5353,名詞,帕巾。用來包裹、遮蓋用的布。
3827,5354,名詞,請帖。邀請赴宴或參加典禮的通知書。
3829,5356,名詞,店東、老闆。
3830,5357,名詞,小店。
3831,5358,名詞,訴訟的事情。
3833,5360,名詞,獨子。唯一的兒子。
3834,5361,名詞,主旨、意旨。行事的目的或主要的旨意。
3835,5362,名詞,指人的來歷、背景。
3836,5363,名詞,父母雙亡，因而失去自家大人們養育和教育的兒童。
3838,5366,名詞,固定的心性、個性、心志。
3839,5368,名詞,訂金。訂購物品時所預付的部分金額。
3840,5369,名詞,商店的門面。
3840,5370,名詞,可直接與來往行人進行交易的商鋪。
3841,5371,名詞,官吏。具有一定職等的政府工作人員。
3842,5372,名詞,伙計、夥計。商店所雇請的員工，負責招呼客人、進行交易。
3847,5377,名詞,利用人類對於宇宙、人生的神祕所發生的驚奇和敬畏心理，構成一種勸善懲惡的教義，並用來教化世人，使人信仰的，稱為宗教。
3848,5378,名詞,人或事的根源、內情、背景。
3850,5380,名詞,政治界。
3850,5381,名詞,官員、官吏階層的生活世界。
3851,5382,名詞,預定或固定的日期或期限。
3855,5388,名詞,時節。四季和二十四節氣的合稱。一年中，依據具有某種特點而區分出來的時期，共有春、夏、秋、冬四季和二十四節氣。
3857,5390,名詞,根蒂。根本，基礎。
3858,5391,名詞,店名。商店的名稱。
3859,5392,名詞,國語的舊稱。
3859,5393,名詞,官場中通用的語言。
3860,5394,名詞,好運氣。
3861,5395,名詞,原意指官員、官吏。
3861,5396,名詞,引申為作威作福的官吏。
3863,5399,名詞,訂金。訂購物品時所預付的部分金額。
3864,5400,名詞,商家所定的貨品價格。
3867,5403,名詞,同一個祖先，有血緣關係的親族。
3867,5404,名詞,相同姓氏或稱同祖先但不同姓氏者，不一定有血緣關係，亦稱為宗親，如張、廖、簡等稱「六桂宗親」。
3868,5405,名詞,商店、店面。
3869,5406,名詞,店主、店東、老闆。
3870,5407,名詞,官員、官吏的職務、職位、等級。
3871,5408,名詞,天干的第七位。
3871,5409,名詞,指年齡、年歲。
3872,5410,名詞,天干的第七位。
3872,5411,名詞,指年齡、年歲。
3873,5412,名詞,處理國家事務的機關或者官員辦公的地方。
3873,5413,名詞,尊稱別人的住宅。
3873,5414,名詞,臺南市的舊稱，府城的簡稱。
3880,5425,名詞,竭盡心力、真誠無私的美德。
3881,5427,名詞,看法。
3881,5428,名詞,思念、掛念。
3883,5431,名詞,人或物天生自然所擁有的本質。
3883,5432,名詞,事物所具有的特質和功能。
3883,5433,名詞,生物的種別或是事物的類別。
3883,5434,名詞,指性情、脾氣。
3883,5435,名詞,範圍、方式。
3883,5436,名詞,與兩性親密行為相關聯的事情。
3889,5446,名詞,怪人。在思想或言行舉止有特異之處的人。
3892,5449,名詞,挖土機。可挖掘砂土或岩石的機械的總稱。通常也可進行堆積或短距離搬運等作業。
3893,5450,名詞,農家用來舀水的器具，形狀略似斗狀。
3893,5451,名詞,下排齒比上排齒突出的嘴形。俗稱「地包天」。
3895,5454,名詞,指下巴長又向外突出的人。
3898,5457,名詞,來回的。
3900,5459,名詞,脾氣、性情。
3901,5460,名詞,水瓢、杓子。用來舀水的長柄器具，略似斗狀。
3902,5461,名詞,稀奇古怪的事。
3904,5463,名詞,生命。
3911,5471,名詞,古時候比縣高一級的地方政府所在地。
3911,5472,名詞,臺南市的舊稱。清朝臺灣府設在現今的臺南市。因為臺南市具有文化古都的地位，現今仍有人沿用舊稱。
3914,5475,名詞,特性、性情品格。
3915,5477,名詞,佛珠、數珠。持誦、念咒時用來集中心神和計算次數的珠串。
3926,5490,名詞,本質、特質。個人與生俱來的特性、氣質。
3932,5497,名詞,一個人的個性、癖好。
3933,5498,名詞,與眾不同的習慣或癖好。
3934,5499,名詞,房間。
3934,5500,名詞,宗族的分支、分家。
3935,5501,名詞,房間。
3936,5502,名詞,處所、場地。
3936,5503,名詞,機關單位。
3940,5513,名詞,曬東西所用的扁平竹編用具。
3946,5538,名詞,刷子。
3952,5556,名詞,經過加工製造而成的絨狀或碎末狀食品。
3957,5581,名詞,音樂的節拍。
3963,5593,名詞,穿鞋的用具。
3967,5608,名詞,功夫的技法。
3973,5634,名詞,灰匙、抹子。泥水匠塗抹水泥時所用的工具。
3980,5641,名詞,打手、保鑣。受人僱用，幫人打架的人。
3986,5649,名詞,一種民俗，源於佛教。中國佛教徒於農曆七月十五日舉行盂蘭盆會，普施一切餓鬼。民間以放水燈通知水中鬼魂和餓鬼，來接受拖捨。水燈一般都以色紙作成蓮花形。在臺灣是用竹條和紙糊製，有圓形燈或小屋形的紙厝。在普渡的前一天，由僧人或道士引導遊行，持圓形燈在前頭，拿紙厝在最後。行至河邊將燈置在水燈筏上，放入水中，稱為「放水燈」。
3989,5652,名詞,寬而平的竹編用具。
3990,5653,名詞,刷子。
3996,5659,名詞,石匠、石工。將石塊製成器物的技術工作者。
4001,5666,名詞,地方。
4003,5669,名詞,接生婆。
4007,5674,名詞, 拾荒的人。
4008,5675,名詞,打字機。用手指控制文字、符號等按鍵，打印出文字或符號的機器。
4011,5678,名詞,肉刺、指甲刺。指甲周圍的角質因為乾裂而翹起來。
4017,5686,名詞,豆類。可採食，也可榨油。多分布在印度東部和埃及，臺灣各地也常可見到零星栽培。因為食用過後，會使人放屁，所以在南部又叫「放屁豆仔」。
4039,5712,名詞,養子女。抱養的子女，不是親生的子女。
4047,5720,名詞,房子、屋子。
4055,5729,名詞,茼蒿。植物名。菊科茼蒿屬，一年生草本。高至70公分，葉互生，邊緣有不規則羽狀分裂。頭狀花序，花黃色或白色。嫩莖及葉可食，為臺灣地區冬季盛產蔬菜之一。一般常用來搭配火鍋或鹹湯圓，由於莖葉的水分多，煮過後會大量失水，只剩一點點，會讓丈夫誤以為被妻子吃掉，所以舊時又稱之為「拍某菜」。
4058,5732,名詞,撿紅點， 一種樸克牌玩牌的方式。
4083,5763,名詞,廣播。一種利用音波和電波傳達訊息的大眾傳播媒介，或特指廣播節目。源自日語。
4086,5766,名詞,泛指資財收入。
4087,5767,名詞,政府向個人或企業依他們的收入比例所課徵的稅。
4088,5768,名詞,水桶。
4103,5784,名詞,掛在商店外面作為市招的看板。
4112,5795,名詞,費用、花費。 
4113,5796,名詞,房子裡面的隔間(客廳、廚房及衛浴除外)。
4132,5822,名詞,計畫。
4153,5847,名詞,舊時宗族的各分系。
4155,5850,名詞,砍伐樹木竹子、劈削木材的工具。
4156,5851,名詞,嵌進斧頭鐵框內的鐵楔子，將鐵塊與木柄套緊，使得斧頭牢靠不脫落。
4156,5852,名詞,一種海中的貝類。
4171,5871,名詞,打鐵匠。以打造鐵器為職業的人。
4172,5872,名詞,牛仔褲。早期美國西部移民者所穿的工作服。用帳篷布縫製而成，質地堅韌，不易磨損。
4184,5885,名詞,衣服的總稱。
4185,5891,名詞,扁平狀的碎片。
4186,5892,名詞,盛置水、酒、飲料的容器。
4186,5894,名詞,杯形的錦標。
4188,5898,名詞,主人。
4189,5900,名詞,片狀的木料或似片狀的物體。
4189,5902,名詞,音樂的節拍。
4189,5903,名詞,指棺材。
4191,5906,名詞,木板。
4191,5907,名詞,似板狀的物體。
4192,5909,名詞,眾所聚皆稱「林」，猶如稱「界」。
4192,5910,名詞,姓氏。
4193,5911,名詞,很多樹集聚而成。
4194,5912,名詞,樹木的果實。
4194,5913,名詞,事情的結束、完結。
4195,5915,名詞,樹椏，樹幹從旁生出的枝條。
4196,5917,名詞,水果。
4197,5918,名詞,果子貍、白鼻心。哺乳動物。食肉目靈貓科，夜行性動物，體色為黃、灰褐色，頭部色較黑，額頭至鼻樑有一條明顯的白色毛。棲息地以闊葉林為主，擅長爬樹，喜歡採食多汁的果類植物，屬於雜食性動物。
4198,5919,名詞,果園。
4199,5920,名詞,友人的通稱。
4201,5922,名詞,杯子。
4202,5923,名詞,棺材。
4203,5924,名詞,薄而平的板子，通常指木板。
4205,5926,名詞,冰棒。在模型中倒入果汁、糖水、紅豆湯或牛奶，並插入竹枝或木條，放置在冰箱中凍結而成的棒狀冰品。
4214,5936,名詞,植物名。露兜樹科露兜樹屬，常綠灌木或小喬木。樹高約二丈，樹幹基部會長出粗大的氣根，氣根入地，就會變成具有支持作用的支柱根。葉子叢生在枝幹的末梢，葉片細長而且尖、帶刺。因為很耐風沙，所以多栽植於濱海地區。材質適合做大廣絃。
4215,5937,名詞,林投姊。臺灣民間故事，描述一位女子被丈夫拋棄後，在林投樹上上吊自殺，變成冤魂報仇的故事。
4218,5941,名詞,冤屈。遭受汙衊或迫害。
4220,5943,名詞,瓜果類。葉子與果實都呈現橢圓形，略似琵琶，果實可以食用，葉子和核可以入藥。
4222,5945,名詞,一般指的是演藝界出眾的人物，也泛指某些行業傑出者。
4223,5946,名詞,亞洲。
4223,5947,名詞,日本。從清代以來到近代對日本的稱呼。
4224,5948,名詞,春風。春天所吹的風。
4224,5949,名詞,從東邊吹過來的風。
4224,5950,名詞,亞洲人、東方人的價值觀或流行風潮；相對於歐洲、美洲人、西方人的價值觀或流行風潮而言。
4227,5953,名詞,海洋名。位於長江口以南、臺灣海峽以北，臺灣、福建、浙江、江蘇南部都濱臨這個海域。
4228,5954,名詞,蕈菇類。散發獨特的香味，日本人嗜食。被視為珍貴的食材。又稱「洋菇」。
4231,5959,名詞,分隔房間的木板牆壁。
4233,5961,名詞,檜木。木本植物。高約二十公尺，樹幹挺直，葉形小，鱗片狀，花單性，雌雄同株，實為球果。葉可入藥，木材很貴重，是高級的木料，可供建築、家具、造船、雕刻以及栽培盆景以觀賞，用途甚廣。
