詞目id,義項id,詞性,解說
1296,1759,擬聲詞,咚。東西投到井中的聲音。
2960,4086,擬聲詞,多用來形容摩托車的聲音。
2961,4087,擬聲詞,擬聲詞。
2963,4091,擬聲詞,形容小動物或細碎尖銳的聲音。常以疊詞出現。
3696,5161,擬聲詞,擬聲詞。嚼食的聲音。
3696,5162,擬聲詞,嘖。因為不耐煩或不愉快而彈舌發出的吸入音。
3712,5188,擬聲詞,心情不耐煩的時候所發出的聲音。
3712,5189,擬聲詞,吃東西時所發出較大的聲音。
4046,5719,擬聲詞,母雞生蛋後所發出一種咕咕叫的聲音。
4772,6695,擬聲詞,羊的叫聲。
4774,6699,擬聲詞,指雞叫聲。
4775,6700,擬聲詞,吐痰的聲音。
4780,6713,擬聲詞,笑聲。
4795,6732,擬聲詞,形容風聲或人的喊叫聲。
4806,6743,擬聲詞,打噴嚏的聲音。
5310,7435,擬聲詞,金石相磨的聲音。
5797,8093,擬聲詞,擬聲詞。
8162,11299,擬聲詞,咳嗽、雷聲等的擬聲詞。
8163,11301,擬聲詞,呼喚別人的發語詞。
8164,11302,擬聲詞,電話中使用的發語詞。
8170,11314,擬聲詞,呼叫雞隻的聲音。飼主要餵食野放的雞時，呼叫「喌喌」(tsû tsû)數聲，雞隻就會圍過來爭食。
8171,11315,擬聲詞,和小嬰兒玩躲迷藏遊戲時，大人忽然出現的時候發出的聲音。
8354,11543,擬聲詞,指小擊的聲音。
9350,12847,擬聲詞,嗡。蚊子的叫聲。
10522,14438,擬聲詞,咀嚼酥脆食物時所發出的清脆聲。
10979,15027,擬聲詞,手掌的拍打聲。
10979,15028,擬聲詞,心跳聲。
11854,16166,擬聲詞,形容細碎的摩擦聲。
11987,16341,擬聲詞,狀聲詞，敲打鑼鈸的聲音。
12126,16531,擬聲詞,短促的嚓嚓聲，如按相機快門或搖晃籤筒發出的聲音。
12941,17586,擬聲詞,形容睡覺打鼾的聲音。
4400,6196,擬態詞,形容筆直而長的樣子。
7663,10648,擬態詞,形容非常甜。
7907,10983,擬態詞,軟綿綿。柔軟而且富有彈性。
8797,12118,擬態詞,硬邦邦。形容物品堅硬，或辦事態度強硬、死板。
11003,15061,擬態詞,形容女人妖嬈嫵媚。
11309,15464,擬態詞,向上發展的狀態。
12283,16732,擬態詞,形容東西扭曲、凹扁、變形。
12283,16733,擬態詞,形容事情弄得一團糟。
12438,16929,擬態詞,形容非常遼闊，一望無垠。
13569,18408,擬態詞,形容堅硬、強硬。
13616,18471,數量, 一大堆、很多。
1,1,數詞,數目。
2,4,數詞,數字。
16,26,數詞,一百零一。
40,59,數詞,數字。
41,62,數詞,數字。
44,70,數詞,數字。 
48,82,數詞,數字。
49,83,數詞,數字。
54,92,數詞,數目。
55,94,數詞,數字。
162,222,數詞,數字。
163,223,數詞,數字。
174,245,數詞,最小的數字，「一」的另一種稱呼。
180,255,數詞,十個百為千。
181,257,數詞,十的百倍，十個百為千。
470,638,數詞,形容數目很多。
565,765,數詞,數字。
578,793,數詞,數字。
579,794,數詞,數字。
790,1081,數詞,數字，指二十，是二十的合音。
818,1158,數詞,二十一。
1388,1930,數詞,四十。為「四十」(sì-tsa̍p)二字的合音。
1408,1980,數詞,數字。
1409,1981,數詞,數字。
2051,2825,數詞,一萬億。
2585,3582,數詞,計數用詞，十的十倍。
2610,3646,數詞,一百二十。這是一種閩南語對於數字的獨特表述模式，從一百一十到一百九十，通常會省略百數之前的一及十位之後的十，如一百二十省略成「百二」(pah-jī)。「百二」常用來祝人長壽。千萬位數亦有同類模式，如「千三、萬二」。
2761,3814,數詞,形容數量眾多。
3582,5000,數詞,數目字，表一對、雙方之意。 
3584,5002,數詞,數目字「二」、雙也。
4380,6169,數詞,數字零。
7851,10890,數詞,一千萬左右。
9861,13540,數詞,十個千為萬。
9955,13678,數詞,一億。
10958,15000,數詞,一萬萬。
3,8,熟語,一刀斬成兩段，比喻斷絕關係。
6,13,熟語,一天到晚、從早到晚，整天。
10,18,熟語,一兩天。
136,193,熟語,人情世故。為人處世的應對進退，多用在婚喪喜慶等應酬、禮尚往來的事宜。
242,362,熟語,不時、經常。
266,397,熟語,形容猶豫不決，意志不堅。
285,417,熟語,卌為四十的意思，上卌表示人到中年的意思。這句話表示人到中年萬事休，生理機能走下坡，心理也逐漸失去青年時期意氣風發的理想。
316,460,熟語,著名的民間故事及戲曲劇目人物。梁山伯與祝英台同窗三年，才知英台是女扮男裝，二人相愛欲成夫妻，祝家卻將英台許配權貴，山伯相思而死，英台跳入山伯墳塚而亡，二人化為彩蝶，比翼雙飛。後也用來比喻苦戀的悲劇人物。
426,588,熟語,東扣西扣。指扣除的項目很多。 
442,606,熟語,非常富有且地位顯貴。
468,635,熟語,誓言感情如山的堅定、如海的深沉。多用來表示對愛情的真誠不變。
725,979,熟語,謙讓之詞，表示承受不起、不敢接受。
856,1205,熟語,亂世、天下大亂。形容國家或局勢動亂不安。
869,1219,熟語,一個多月。
884,1239,熟語,不嫌棄。通常是在受到稱讚後的謙虛用語。
886,1241,熟語,不甘心、不甘願。
908,1269,熟語,不肖之徒。罵人不像樣。
913,1275,熟語,不像話、不像樣。
937,1307,熟語,氣急攻心、火冒三丈。
953,1327,熟語,指人輾轉難眠，睡不著覺。
953,1328,熟語,形容人意志不堅，經常變換主意。
978,1360,熟語,不知死活。指不知事情輕重或利害程度，而冒昧行事。
985,1370,熟語,形容人難取悅，或事情難應付。
992,1378,熟語,不對勁。
1011,1402,熟語,反倒、反而。
1048,1443,熟語,不情不願。
1128,1538,熟語,短命鬼。詛咒人短命早死的用語。
1210,1639,熟語,心驚膽顫。
1334,1834,熟語,指相互之間傾全力爭鬥。
1335,1835,熟語,同父異母。
1426,2004,熟語,三託四請。多方請託別人提供協助。
1466,2055,熟語,賺死了。指得到便宜或意外的好處。
1541,2134,熟語,道路交接互通，形容交通便利的樣子。
1563,2159,熟語,解除因為受內外傷而產生的血氣鬱結。
1621,2225,熟語,說了不該說的話。
1645,2267,熟語,公平。
1790,2460,熟語,形容時機剛好，適合做某件特別的事情。
1843,2544,熟語,「有路用」(ū-lōo-īng)指有用，「無路用」(bô-lōo-īng)指沒有用。
2266,3136,熟語,樹頭鮮。成熟度為八、九分以上才摘取下來的水果。它的味道比六、七分熟就摘取下來催熟的水果甜美。引申「催熟」臺灣閩南語說成「隱」。「在欉黃」的水果不需催熟，說成「無隱」，諧音「無穩」，意思就是「不穩當」。
2315,3222,熟語,沒有病痛的人。
2320,3227,熟語,不過爾爾。不過就是這樣而已。
2320,3228,熟語,如此云云，表示就是這樣。
2330,3240,熟語,指孩子健康，很好養育。
2392,3315,熟語,指人手腳細嫩，不適合粗活。
2446,3417,熟語,說一不二。形容說話算話，堅定不移。
2453,3430,熟語,死樣子、死相。罵人的話。
2480,3460,熟語,准聽不准說。是一種斥責小孩子在不當場合亂說話的說法。
2481,3461,熟語,吃閒飯。比喻只消費而不事生產。
2494,3478,熟語,指那些沒有意義或沒有內容的事情。
2495,3479,熟語,器物接合的地方，凸的部分叫「榫」，就是「榫頭」，凹陷的部分叫「空」，就是「榫眼」。有凹進去的榫眼，卻沒有接合的榫頭，用來比喻不合理、不著邊際或沒有結果的事情。
2502,3487,熟語,對事情嚴重程度的一種慣用說法。
2508,3493,熟語,定時、有時間性。
2508,3494,熟語,偶爾、非經常性。
2545,3538,熟語,金盆洗手。江湖人物宣布退隱的儀式。使用金盆以表示決心的堅定，故稱為金盆洗手。
2548,3542,熟語,死在路邊，是詛咒別人慘遭橫死的一種說法。
2568,3562,熟語,指不肯承擔責任，硬要賴給別人。
2572,3566,熟語,有始有終。有開頭，有結尾，比喻做事貫徹到底。
2656,3697,熟語,比喻問題或者事故很多。
2656,3698,熟語,指瑕疵漏洞很多。
2657,3699,熟語,自己做錯事或者講錯話，由自己承擔後果。
2658,3700,熟語,自己所造的惡孽。
2691,3735,熟語,走後門。利用不正當的手段來達到某種目的。
2707,3753,熟語,氣定神閒、處之泰然。遇到事情時態度鎮定，神色自若，自信到彷彿一切情況都在掌握中。
2992,4131,熟語,形容一個家庭吵鬧不休，不得安寧。
2993,4132,熟語,吵得家裡不得安寧。
3012,4152,熟語,殺雞儆猴、殺一儆百。懲罰一個人以警告其他人服從的權術。
3168,4385,熟語,比喻煽動、挑撥使兩方爭鬥。
3312,4604,熟語,求神拜佛。向神佛祈求保祐。
3452,4827,熟語,分不開身。
3453,4828,熟語,脫逃不了或閃躲不及。
3465,4840,熟語,喪家在喪禮中請道士做法事的時候，道士手裡拿著紙馬紙人，在法壇四周來回遊走，是一種為死者超渡的儀式。
3534,4942,熟語,裝蒜。裝不知道。
3577,4993,熟語,裝瘋賣傻。
3624,5073,熟語,丟人現眼。
3639,5090,熟語,初次見面。
3658,5110,熟語,使祖上蒙羞。
3662,5114,熟語,不敢當、承受不起。謙虛語。
3665,5117,熟語,不肯承擔責任、把責任推得一乾二淨。
3670,5122,熟語,擔待不起。一種謙虛的話。
3798,5299,熟語,兩家人的女兒互相嫁到對方家裡去。自己家中的女兒為「姑」，娶進來的是「嫂」。家中的「姑」出嫁，其婆家的女兒又嫁到自己家中，就會有「姑」換「嫂」的情況。被視為親上加親，或較貧困的家庭難以置辦聘金與嫁妝的情況下一種連姻的選擇。
3823,5350,熟語,咒罵人老年時會像無毛雞一樣沒有毛保暖，絕子絕孫、孤苦無依。
3824,5351,熟語,咒罵人絕子絕孫、孤老無依。
4024,5695,熟語,長期生病無法治癒或身體狀況很差，多用於形容人在這種狀態下還必須極度辛苦地過日子。
4050,5723,熟語,罵人的話，用在許多的狀況中，但多用在罵人做事拖拉遲緩。
4050,5724,熟語,被折磨得很淒慘。
4063,5739,熟語,併吞、生吞活剝。吞進肚子裡，引申為用強烈的手段侵占欺負他人。
4076,5755,熟語,不照原來的約定之行程或過程，中途拋棄或爽約。
4095,5776,熟語,打通關。在酒宴上向人輪番敬酒一個巡迴。
4128,5817,熟語,開夜車、熬夜。比喻為了趕時間，利用夜晚休息時間繼續工作或學習。
4145,5839,熟語,自家養的母豬與別人的種豬交配生產時，出種豬的一方可分得部分仔豬。引申為女兒出嫁所生的小孩中，選其中一、兩人(通常包括次子)從母姓，叫做「抽豬母稅」。
4226,5952,熟語,形容亂七八糟的樣子。
4345,6113,熟語,父親年事已高，兒子年紀尚小，彼此雙方年歲相差甚大。
4457,6285,熟語,習慣性流產。因為先天性的染色體異常或產婦本身子宮異常等不明原因，造成多次自然流產即稱為習慣性流產，這種情形，俗稱「花袂牢枝」。
4577,6451,熟語,本指人的臉色青綠，長牙外露。形容面貌凶惡可怕。亦可指鬼卒。
4623,6503,熟語,喜新厭舊。喜歡新的，厭棄舊的。大多形容人對愛情不專一。
4638,6518,熟語,住在廟宇附近，而對廟內神明心存輕視不敬的態度。引申為對身旁的人表現出輕忽、漠視的態度。
4639,6519,熟語,突如其來。形容出乎意料的突然來到或發生。
4685,6579,熟語,折壽。折損本來應該享有的壽命。
4715,6624,熟語,事情的起因和結果。
4793,6730,熟語,罵人如喪父喪母般吵吵嚷嚷、鬼吼鬼叫、呼天搶地。
4808,6745,熟語,表示抱怨或表達情緒的詞。
4861,6823,熟語,指度過較不景氣的時機。
4871,6834,熟語,隱隱作痛。
5003,7029,熟語,掏心挖肺，表示真心誠意。
5026,7060,熟語,為什麼。詢問目的或原因的疑問詞，現今受華語影響，漸漸地被「為啥物」(uī-siánn-mih)取代。
5047,7084,熟語,兩對夫婦在彼此妻子懷孕時，為腹中的胎兒定下婚約，如果將來雙方妻子所生下的孩子為一男一女，長大後就讓他們結為夫妻。
5114,7160,熟語,小孩子不管餓或飽，都會吵鬧不休，泛指無理取鬧。
5143,7206,熟語,過去是指紅杏出牆的老婆被先生捉姦後，透過旁人協調，由姦夫準備炮燭登門謝罪。後用於一般事件上，由被傷害者向傷害者求償，以彌補內心的不滿。
5208,7300,熟語,特指好色之徒見美色而流口水的樣子。
5237,7343,熟語,來往、打交道。
5244,7351,熟語,互相洩底。
5265,7376,熟語,摩肩接踵。指人多且擁擠的樣子。
5424,7590,熟語,臉色紅潤，形容身體健康。
5467,7641,熟語,好像有又好像沒有的意思。
5535,7733,熟語,指不平衡、輕重不一或不公平。
5582,7809,熟語,指不在家吃飯，到外面用餐。
5604,7838,熟語,茶來伸手，飯來張口。形容人只知生活的享受，卻不知享受的條件來自別人勞動的辛苦。
5629,7868,熟語,茶來伸手，飯來張口。形容人只知生活的享受，卻不知享受的條件來自別人勞動的辛苦。
5632,7871,熟語,欺軟怕硬、欺善怕惡。
5670,7914,熟語,風雨及時而適量。比喻豐年安樂的景象。
5673,7917,熟語,膨餅，是一種傳統的小吃甜食。其音為phòng-piánn，與華語「碰壁」的臺灣閩南語讀音phòng piah非常近似。因此，「食膨餅」的意思就是兼取華語「碰壁」之意。
5678,7923,熟語,上班、就業。
5682,7930,熟語,捕風捉影。一點點兒的小事被誇張得很大。
5827,8130,熟語,罵人如喪父喪母般吵吵嚷嚷、鬼吼鬼叫、呼天搶地。
5833,8137,熟語,睡覺的通俗說法，常用在哄小孩子睡覺的時候。
5941,8300,熟語,頭臉都覆蓋住。比喻呆頭呆腦、不知死活。
6029,8434,熟語,無時無刻。
6054,8465,熟語,意外、意想不到。
6171,8638,熟語,氣憤填膺。形容極度生氣，滿懷憤恨。
6247,8735,熟語,亂來、瞎搞。
6256,8745,熟語,消除災禍、解掉災難。
6312,8812,熟語,消瘦、面黃肌瘦。
6316,8816,熟語,指人不精細分明、過於草率，喜歡胡說八道。
6471,9030,熟語,笑逐顏開、眉開眼笑。形容心中非常高興，連臉上都充滿著歡喜的神情。
6638,9234,熟語,無法收拾。
6648,9246,熟語,無法事先預料或打算。
6650,9248,熟語,茶飯不思、寢食難安。形容情緒或者精神不佳，吃不下飯，睡不著。
6654,9252,熟語,無以為生。沒有辦法維持生計。
6654,9253,熟語,過不去。
6654,9254,熟語,過意不去。
6662,9262,熟語,好比說、好像說。
6663,9263,熟語,說不得，不能說。無法接受別人的規勸，或是事情有禁忌，不能說。語氣完結時唸作bē-kóng--tit。
6663,9264,熟語,沒話說，非常的，難以言喻的。語氣完結時唸作bē-kóng--tit。
6664,9265,熟語,通常指經過言詞勸說之後，仍無法改變對方的態度或想法。
6691,9317,熟語,不爽、不高興。
6693,9319,熟語,情緒好、心情好。「起毛」是日語外來語素，加上表示「爽快」的「婸」。
6704,9331,熟語,那有這種道理。通常用來表示憤怒。
6761,9396,熟語,動手動腳。常指兩方因為爭執不下而爆發肢體衝突。
6782,9419,熟語,起藥布疹。指貼膏藥過後引發皮膚的發炎紅腫。
6827,9501,熟語,單挑、一對一。雙方都是一人出戰。
6857,9536,熟語,把兩個東西裝配在一起。
6928,9634,熟語,不依照生產或工程所規定的質量要求，而削減工序或用料。也比喻做事取巧。
6938,9644,熟語,假惺惺、佯裝。
6951,9660,熟語,假好心、貓哭耗子假慈悲。
6954,9664,熟語,裝瘋賣傻。故意裝成痴呆瘋癲的樣子。 
6958,9668,熟語,私下交往、秘密往來。
6962,9672,熟語,紅杏出牆。指已婚婦女與其他男子有不正常的交往關係。
6972,9684,熟語,裝神弄鬼、裝模作樣。
7117,9873,熟語,娶媳婦。
7246,10056,熟語,疼惜有加、十分珍惜。
7277,10090,熟語,指在軍隊中，士兵站崗護衛。
7277,10091,熟語,比喻男生在女生住處門口苦候。
7336,10209,熟語,使眼色。
7337,10210,熟語,抓替死鬼。在民俗信仰上，相傳人意外身亡之後，魂魄會留在原地，只要有人在原地區以相同方式死亡，自己便能被取代而投胎轉世，故冤魂為了抓取他人魂魄，便害人致死。
7343,10217,熟語,剔除泥腸。烹飪之前將蝦子背上蝦肉裡的泥腸剔掉，會比較乾淨好吃。
7348,10223,熟語,抓兔子、嘔吐。因為嘔吐是不舒服的感覺，所以用與「吐」諧音的「兔」來委婉地表達。
7349,10224,熟語,採取橫向。
7355,10232,熟語,取長補短、截長補短。取有餘以補不足。
7386,10267,熟語,不得要領、抓不到頭緒。
7414,10300,熟語,顧此失彼。注意這個卻忽略了那個。指不能全面兼顧。
7483,10394,熟語,死去活來、尋死覓活。形容非常痛苦或悲傷，要死不要活的樣子。
7484,10395,熟語,幹嘛、做什麼。帶有疑問的口氣。
7562,10506,熟語,添福添壽。
7562,10507,熟語,逢年有閏月時，出嫁的女兒應送母親一樣禮物，為母親去災解禍，稱為「添福壽」或「添壽」，母親則以湯圓、花生等吉祥物回禮，是臺灣民間的一種習俗。
7655,10640,熟語,甜美動人的言語。
7764,10780,熟語,家常便飯、粗茶淡飯。多為請客時自謙的說法。
7969,11055,熟語,得寸進尺。軟的泥土比較容易挖掘，用來比喻老實人或讓步者容易被欺負。
8017,11133,熟語,民間傳說，也是歌仔戲著名戲目。泉州陳三在燈會中邂逅潮州黃五娘，一見鍾情，五娘以荔枝為信，陳三假扮磨鏡師，故意弄破寶鏡賣身黃家，但五娘已許婚給紈絝子弟林大，卻在丫鬟益春的協助下私奔，經過一番波折，二人終成眷屬。又名「荔鏡記」。
8195,11351,熟語,指信仰佛道的善心男女。
8222,11380,熟語,哭哭啼啼、哭泣不止。
8237,11396,熟語,坐享其成。原意為收割稻子，引申為罵人不勞而獲。
8362,11558,熟語,參加其中一部分。
8388,11587,熟語,插話、插嘴。別人講話時，從中插進去說話。
8432,11653,熟語,難道不是嗎？可不是嗎？
8435,11656,熟語,豈有、哪有。
8573,11838,熟語,不一定、不確定。
8574,11839,熟語,白費時間，永無終止。
8578,11844,熟語,沒大沒小、沒禮貌。
8582,11849,熟語,沒有天理。通常用在感嘆人事不公。
8588,11856,熟語,沒事、沒怎樣。通常用在說人反應過度或做了多餘、不該做的事。
8592,11861,熟語,不得已、沒有辦法怎麼樣。
8597,11866,熟語,不要緊、沒關係。通常用於表示還有更糟的事情。
8602,11871,熟語,昧著良心、沒良心。
8603,11872,熟語,喻沒有用、不中用。
8604,11873,熟語,無依無靠。
8606,11876,熟語,不得已、無可奈何、沒有辦法。
8607,11877,熟語,無可奈何、不得已。
8610,11881,熟語,不要緊、沒關係。
8611,11882,熟語,拿他沒辦法、奈何不了他。
8612,11883,熟語,沒辦法、沒能力。
8612,11884,熟語,表示無可奈何。
8613,11885,熟語,沒有法紀天理。形容人明目張膽，無所忌憚。
8618,11891,熟語,單身、沒有家累。指一個人沒有妻子兒女。
8622,11896,熟語,無所謂、無關緊要。形容人做事懶散、不用心，沒什麼責任感。
8623,11897,熟語,不要緊、沒關係。
8635,11910,熟語,沒什麼、沒關係。表示不在乎、無所謂的態度。
8637,11912,熟語,沒什麼。
8652,11932,熟語,不夠意思。通常用在說人對朋友沒義氣，或對他人的言行感到不滿。
8658,11940,熟語,沒日沒夜、夜以繼日。形容人對事情太投入，不管白天或晚上都不休息。
8667,11950,熟語,子虛烏有、毫無根據。
8672,11956,熟語,沒錯，用來強調完全正確。
8678,11962,熟語,不動聲色、不聲不響。
8679,11963,熟語,不言不語、不動聲色、不聲不響。形容人不出聲音或無預警地就做出動作反應。
8682,11966,熟語,無妨、無礙。沒有什麼差別，不會受到影響。語氣完結時唸作bô-gāi--tio̍h。
8716,12014,熟語,筋骨或肌肉酸痛、抽痛。
8788,12108,熟語,硬碰硬。用強力對付強力。
9018,12397,熟語,失竊、遭小偷。
9069,12466,熟語,漁民打魚時看潮汐漲落行事。比喻做事適時或趕上需要。
9077,12477,熟語,指很麻煩、費力氣的意思。
9319,12814,熟語,傳宗接代。
9325,12821,熟語,敗壞社會風俗習慣。
9337,12833,熟語,因事情麻煩不易解決而煩惱。
9419,12931,熟語,盪鞦韆。
9442,12967,熟語,胡思亂想。想這個想那個。
9443,12968,熟語,計畫性地想盡各種辦法去做壞事。
9499,13057,熟語,哄騙、唬弄。用虛誇不實的言語哄騙。
9508,13068,熟語,指做事情膚淺不深入，或只是短暫停留，就像沾醬油一樣。
9514,13075,熟語,把屎把尿，形容照顧的辛勞。
9541,13106,熟語,拉拉扯扯。一方抓住不放，另一方想奮力掙脫。
9577,13169,熟語,塞手縫。指東西很少，不能讓人滿足。
9723,13348,熟語,按部就班。照一定的條理順序處理事情。
9724,13349,熟語,依約行事。依照之前說好的來進行。
9766,13396,熟語,大白天。特別強調說話的當時為白天。
9767,13397,熟語,當面、面對面。
9870,13570,熟語,落人口實。即遭受他人的批評。
9890,13596,熟語,結婚後的第三天，新娘的兄弟前來男方家，探望新婦嫁後的起居情況，而男方家須以禮款待。
9909,13620,熟語,肚子餓。
9917,13629,熟語,白走一趟。
9917,13630,熟語,由空車去一趟行程。
9949,13668,熟語,指事情非常周全，絕不會出差錯。
10016,13757,熟語,試試看。
10032,13777,熟語,裝傻搞笑，將人當瘋子一樣耍弄。
10074,13833,熟語,細皮嫩肉、玉手纖纖。
10083,13845,熟語,毛手毛腳、動手動腳。
10115,13885,熟語,氣到直跺腳。
10182,13995,熟語,較容易。
10182,13996,熟語,快一點。
10315,14171,熟語,金屋藏嬌、包養女人、包二奶。
10324,14180,熟語,用力捶桌子、椅子，表示強烈的抗議、反對。
10391,14258,熟語,也是。
10396,14264,熟語,難做。
10397,14265,熟語,也要。
10402,14270,熟語,滴滴答答滴個不停。
10406,14275,熟語,難說、不好講。
10510,14424,熟語,慢走。對即將離開的人所說的客套話。
10520,14435,熟語,慢慢來。安撫人的話語，叫人別著急。
10554,14478,熟語,摸不著門路，不知從何下手。
10578,14508,熟語,處處、遍地。到處都是。
10586,14516,熟語,屁滾尿流。
10596,14527,熟語,到處、處處。
10641,14582,熟語,端架子。刻意抬高自己的身分，傲慢的對待別人。
10717,14692,熟語,不管他、不理會他。
10724,14702,熟語,划不來。不合算、不值得。
10730,14708,熟語,不划算、划不來。
10754,14737,熟語,私奔。通常指女子未經家長同意即私自歸屬所愛的人，或相偕遠走。
10759,14742,熟語,死心塌地，堅持到底。
10762,14745,熟語,事緩則圓、急事緩辦、欲速則不達。勸人不要心急，再緊急的事都要慢慢來。
10765,14748,熟語,跟前跟後。
10827,14829,熟語,發誓不與敵人並立於天地之間，用來比喻仇恨極深。
10867,14884,熟語,形容女人帶有剋夫的命相。以前的人通常會以「鉸刀爿，鐵掃帚」來譏諷剋夫的女人。
11022,15091,熟語,塞手指間的縫隙，用來比喻些微之數。
11046,15116,熟語,慢慢來。叫人不要著急。
11092,15167,熟語,愁眉苦臉。形容憂傷、愁苦的神色。
11542,15769,熟語,指拉警報。
11542,15770,熟語,以前正午報時也會「霆水螺」，目的在通知眾人某事，和拉警報的響法不同。
11594,15832,熟語,形容一個人很吵雜，擾人清靜，多用來罵人。
11748,16031,熟語,裝傻。
11814,16118,熟語,比喻欺騙的手法很高明。
11841,16151,熟語,甜甜蜜蜜。
11865,16180,熟語,凸肚子短命鬼。咒罵人早死的用語。
11930,16266,熟語,為謀奪錢財而傷人性命。
12000,16363,熟語,隨便你。
12023,16391,熟語,見機行事、因時制宜。臨事能妥善變通處置。
12065,16454,熟語,頭暈目眩、頭昏眼花。頭腦昏沈，視覺模糊。
12335,16798,熟語,見機行事。指遇到事情，能用妥善方法加以處理、應付。
12343,16806,熟語,口口聲聲。
12372,16850,熟語,說大話、吹噓。
12642,17212,熟語,指專門在錢上鑽營。
12647,17218,熟語,拐彎抹角。比喻說話或做事不爽快。
12693,17279,熟語, 雙面人。比喻人陰險狡猾，善耍兩面手法。
13094,17779,熟語,指汙穢骯髒。
13125,17815,熟語,礙手礙腳。妨害別人做事，使人感到不便。
13150,17849,熟語,形容長得瘦但體格卻是結實強健。
13160,17859,熟語,固執的、頑固的、不信邪的。
13172,17875,熟語,招人討厭、嫌棄。
13173,17876,熟語,照顧三餐，引申為求溫飽。
13200,17911,熟語,形容曲折不直。
13200,17912,熟語,拐彎抹角。比喻說話或做事不直截了當。
13391,18171,熟語,瞻前顧後、兼顧前後。比喻做事謹慎周密。
13474,18278,熟語,很會挑選最好的，引申為鑽營求取利益。
13598,18450,熟語,爬上爬下。
13627,18482,熟語,縮手縮腳、畏首畏尾。
13628,18483,熟語,反覆無常。
13632,18487,熟語,高抬貴手。
13635,18490,熟語,洪水造成的山坡崩塌。
